{
  "$schema": "https://json-schema.org/draft/2020-12/schema",
  "title": "Project Testcase Index",
  "type": "object",
  "required": ["project_code", "index_type", "generated_at", "items"],
  "properties": {
    "project_code": { "type": "string" },
    "index_type": { "type": "string", "const": "testcase" },
    "generated_at": { "type": "string" },
    "items": {
      "type": "array",
      "items": {
        "type": "object",
        "required": [
          "testcase_id",
          "work_item_id",
          "title",
          "priority",
          "page_name",
          "section_name",
          "source_path"
        ],
        "properties": {
          "testcase_id": { "type": "string" },
          "work_item_id": { "type": "string" },
          "title": { "type": "string" },
          "priority": { "type": "string" },
          "page_name": { "type": "string" },
          "section_name": { "type": "string" },
          "source_path": { "type": "string" }
        },
        "additionalProperties": true
      }
    }
  },
  "additionalProperties": false
}
