{
  "project_code": "WX-YGJ",
  "index_type": "testcase",
  "generated_at": "2026-08-06T18:23:48",
  "items": [
    {
      "testcase_id": "WX-YGJ-ADD-FORM-B-AB-001",
      "work_item_id": "PT083",
      "title": "尝试违反限制时阻止提交：“宣传口号”超过一行时在C端换行展示",
      "priority": "P0",
      "page_name": "盒子管理后台-云手机商品管理-添加",
      "section_name": "商品添加表单",
      "module_name": "云手机商品管理",
      "feature_name": "商品添加表单",
      "source_path": "work_items/PT083/testcases/testcases_main.md"
    },
    {
      "testcase_id": "WX-YGJ-ADD-FORM-B-AB-002",
      "work_item_id": "PT083",
      "title": "尝试违反限制时阻止提交：“性能参数”超过一行时在C端换行展示",
      "priority": "P0",
      "page_name": "盒子管理后台-云手机商品管理-添加",
      "section_name": "商品添加表单",
      "module_name": "云手机商品管理",
      "feature_name": "商品添加表单",
      "source_path": "work_items/PT083/testcases/testcases_main.md"
    },
    {
      "testcase_id": "WX-YGJ-ADD-FORM-B-AB-013",
      "work_item_id": "PT083",
      "title": "尝试违反限制时阻止提交：正整数，上限1000；相同排序值按创建时间倒序排列",
      "priority": "P0",
      "page_name": "盒子管理后台-云手机商品管理-添加",
      "section_name": "商品添加表单",
      "module_name": "云手机商品管理",
      "feature_name": "商品添加表单",
      "source_path": "work_items/PT083/testcases/testcases_main.md"
    },
    {
      "testcase_id": "WX-YGJ-ADD-FORM-B-AB-016",
      "work_item_id": "PT083",
      "title": "尝试违反限制时阻止提交：已有功能，数值限制大于0.00",
      "priority": "P0",
      "page_name": "盒子管理后台-云手机商品管理-添加",
      "section_name": "商品添加表单",
      "module_name": "云手机商品管理",
      "feature_name": "商品添加表单",
      "source_path": "work_items/PT083/testcases/testcases_main.md"
    },
    {
      "testcase_id": "WX-YGJ-ADD-FORM-B-AB-017",
      "work_item_id": "PT083",
      "title": "尝试违反限制时阻止提交：已有功能，数值限制大于0.00",
      "priority": "P0",
      "page_name": "盒子管理后台-云手机商品管理-添加",
      "section_name": "商品添加表单",
      "module_name": "云手机商品管理",
      "feature_name": "商品添加表单",
      "source_path": "work_items/PT083/testcases/testcases_main.md"
    },
    {
      "testcase_id": "WX-YGJ-ADD-FORM-B-AB-018",
      "work_item_id": "PT083",
      "title": "尝试违反限制时阻止提交：数字选择器，必填；天最大370、时最大23，所有项不可同时为0，后端以秒为单位",
      "priority": "P0",
      "page_name": "盒子管理后台-云手机商品管理-添加",
      "section_name": "商品添加表单",
      "module_name": "云手机商品管理",
      "feature_name": "商品添加表单",
      "source_path": "work_items/PT083/testcases/testcases_main.md"
    },
    {
      "testcase_id": "WX-YGJ-ADD-FORM-B-AB-019",
      "work_item_id": "PT083",
      "title": "尝试违反限制时阻止提交：下拉单选，必填，content：{特殊区}、{普通区}；{特殊区}商品数量小于等于4",
      "priority": "P0",
      "page_name": "盒子管理后台-云手机商品管理-添加",
      "section_name": "商品添加表单",
      "module_name": "云手机商品管理",
      "feature_name": "商品添加表单",
      "source_path": "work_items/PT083/testcases/testcases_main.md"
    },
    {
      "testcase_id": "WX-YGJ-ADD-FORM-B-AB-020",
      "work_item_id": "PT083",
      "title": "尝试违反限制时阻止提交：数字框，必填，正整数，上限1000；相同值按创建时间倒序",
      "priority": "P0",
      "page_name": "盒子管理后台-云手机商品管理-添加",
      "section_name": "商品添加表单",
      "module_name": "云手机商品管理",
      "feature_name": "商品添加表单",
      "source_path": "work_items/PT083/testcases/testcases_main.md"
    },
    {
      "testcase_id": "WX-YGJ-ADD-FORM-B-FN-021",
      "work_item_id": "PT083",
      "title": "确认已有功能，增加「未配置」说明；“服务时长”结束后C端不再展示",
      "priority": "P1",
      "page_name": "盒子管理后台-云手机商品管理-添加",
      "section_name": "商品添加表单",
      "module_name": "云手机商品管理",
      "feature_name": "商品添加表单",
      "source_path": "work_items/PT083/testcases/testcases_main.md"
    },
    {
      "testcase_id": "WX-YGJ-ADD-FORM-B-AB-022",
      "work_item_id": "PT083",
      "title": "尝试违反限制时阻止提交：数字框，非必填，正整数，上限200；按固定频率校验库存",
      "priority": "P0",
      "page_name": "盒子管理后台-云手机商品管理-添加",
      "section_name": "商品添加表单",
      "module_name": "云手机商品管理",
      "feature_name": "商品添加表单",
      "source_path": "work_items/PT083/testcases/testcases_main.md"
    },
    {
      "testcase_id": "WX-YGJ-ADD-FORM-B-AB-023",
      "work_item_id": "PT083",
      "title": "尝试违反限制时阻止提交：下拉单选，必填，content：盒子后台管理员列表",
      "priority": "P0",
      "page_name": "盒子管理后台-云手机商品管理-添加",
      "section_name": "商品添加表单",
      "module_name": "云手机商品管理",
      "feature_name": "商品添加表单",
      "source_path": "work_items/PT083/testcases/testcases_main.md"
    },
    {
      "testcase_id": "WX-YGJ-ADD-FORM-SVC-ST-024",
      "work_item_id": "PT083",
      "title": "确认库存检查任务处理：云手机相关报警",
      "priority": "P0",
      "page_name": "盒子管理后台-云手机商品管理-添加",
      "section_name": "商品添加表单",
      "module_name": "云手机商品管理",
      "feature_name": "商品添加表单",
      "source_path": "work_items/PT083/testcases/testcases_main.md"
    },
    {
      "testcase_id": "WX-YGJ-ADD-FORM-B-FN-026",
      "work_item_id": "PT083",
      "title": "确认玩心盒子后台_云挂机_云手机商品管理",
      "priority": "P1",
      "page_name": "盒子管理后台-云手机商品管理-添加",
      "section_name": "商品添加表单",
      "module_name": "云手机商品管理",
      "feature_name": "商品添加表单",
      "source_path": "work_items/PT083/testcases/testcases_main.md"
    },
    {
      "testcase_id": "WX-YGJ-ADD-FORM-B-ST-027",
      "work_item_id": "PT083",
      "title": "确认跨端联动结果：配置ID、商品名称、“云机类型”、云机“服务时长”、通知时间、通知人由配置或系统生成",
      "priority": "P0",
      "page_name": "盒子管理后台-云手机商品管理-添加",
      "section_name": "商品添加表单",
      "module_name": "云手机商品管理",
      "feature_name": "商品添加表单",
      "source_path": "work_items/PT083/testcases/testcases_main.md"
    },
    {
      "testcase_id": "WX-YGJ-ADD-FORM-B-FN-030",
      "work_item_id": "PT083",
      "title": "确认“宣传口号”超过一行时在C端换行展示",
      "priority": "P1",
      "page_name": "盒子管理后台-云手机商品管理-添加",
      "section_name": "商品添加表单",
      "module_name": "云手机商品管理",
      "feature_name": "商品添加表单",
      "source_path": "work_items/PT083/testcases/testcases_main.md"
    },
    {
      "testcase_id": "WX-YGJ-ADD-FORM-B-BD-031",
      "work_item_id": "PT083",
      "title": "确认“性能参数”超过一行时在C端换行展示",
      "priority": "P1",
      "page_name": "盒子管理后台-云手机商品管理-添加",
      "section_name": "商品添加表单",
      "module_name": "云手机商品管理",
      "feature_name": "商品添加表单",
      "source_path": "work_items/PT083/testcases/testcases_main.md"
    },
    {
      "testcase_id": "WX-YGJ-ADD-FORM-B-AB-040",
      "work_item_id": "PT083",
      "title": "尝试违反限制时阻止提交：点击【增加】一条宣传配置，最多额外新增1块；达到2条时禁用按钮",
      "priority": "P1",
      "page_name": "盒子管理后台-云手机商品管理-添加",
      "section_name": "商品添加表单",
      "module_name": "云手机商品管理",
      "feature_name": "商品添加表单",
      "source_path": "work_items/PT083/testcases/testcases_main.md"
    },
    {
      "testcase_id": "WX-YGJ-ADD-FORM-B-BD-043",
      "work_item_id": "PT083",
      "title": "确认库存不足时同步隐藏商品、停止分配云机并发送告警",
      "priority": "P1",
      "page_name": "盒子管理后台-云手机商品管理-添加",
      "section_name": "商品添加表单",
      "module_name": "云手机商品管理",
      "feature_name": "商品添加表单",
      "source_path": "work_items/PT083/testcases/testcases_main.md"
    },
    {
      "testcase_id": "WX-YGJ-ADD-FORM-B-AB-045",
      "work_item_id": "PT083",
      "title": "尝试违反限制时阻止提交：“宣传口号”超过一行时在C端换行展示",
      "priority": "P1",
      "page_name": "盒子管理后台-云手机商品管理-添加",
      "section_name": "商品添加表单",
      "module_name": "云手机商品管理",
      "feature_name": "商品添加表单",
      "source_path": "work_items/PT083/testcases/testcases_main.md"
    },
    {
      "testcase_id": "WX-YGJ-ADD-FORM-B-AB-046",
      "work_item_id": "PT083",
      "title": "尝试违反限制时阻止提交：“性能参数”超过一行时在C端换行展示",
      "priority": "P1",
      "page_name": "盒子管理后台-云手机商品管理-添加",
      "section_name": "商品添加表单",
      "module_name": "云手机商品管理",
      "feature_name": "商品添加表单",
      "source_path": "work_items/PT083/testcases/testcases_main.md"
    },
    {
      "testcase_id": "WX-YGJ-ADD-FORM-B-FN-054",
      "work_item_id": "PT083",
      "title": "确认正整数，上限1000；相同排序值按创建时间倒序排列",
      "priority": "P1",
      "page_name": "盒子管理后台-云手机商品管理-添加",
      "section_name": "商品添加表单",
      "module_name": "云手机商品管理",
      "feature_name": "商品添加表单",
      "source_path": "work_items/PT083/testcases/testcases_main.md"
    },
    {
      "testcase_id": "WX-YGJ-ADD-FORM-B-FN-055",
      "work_item_id": "PT083",
      "title": "确认已有功能，数值限制大于0.00",
      "priority": "P1",
      "page_name": "盒子管理后台-云手机商品管理-添加",
      "section_name": "商品添加表单",
      "module_name": "云手机商品管理",
      "feature_name": "商品添加表单",
      "source_path": "work_items/PT083/testcases/testcases_main.md"
    },
    {
      "testcase_id": "WX-YGJ-ADD-FORM-B-FN-056",
      "work_item_id": "PT083",
      "title": "确认已有功能，数值限制大于0.00",
      "priority": "P1",
      "page_name": "盒子管理后台-云手机商品管理-添加",
      "section_name": "商品添加表单",
      "module_name": "云手机商品管理",
      "feature_name": "商品添加表单",
      "source_path": "work_items/PT083/testcases/testcases_main.md"
    },
    {
      "testcase_id": "WX-YGJ-ADD-FORM-B-FN-057",
      "work_item_id": "PT083",
      "title": "确认数字选择器，必填；天最大370、时最大23，所有项不可同时为0，后端以秒为单位",
      "priority": "P1",
      "page_name": "盒子管理后台-云手机商品管理-添加",
      "section_name": "商品添加表单",
      "module_name": "云手机商品管理",
      "feature_name": "商品添加表单",
      "source_path": "work_items/PT083/testcases/testcases_main.md"
    },
    {
      "testcase_id": "WX-YGJ-ADD-FORM-B-FL-074",
      "work_item_id": "PT083",
      "title": "确认跨端联动结果：配置ID、商品名称、“云机类型”、云机“服务时长”、通知时间、通知人由配置或系统生成",
      "priority": "P0",
      "page_name": "盒子管理后台-云手机商品管理-添加",
      "section_name": "商品添加表单",
      "module_name": "云手机商品管理",
      "feature_name": "商品添加表单",
      "source_path": "work_items/PT083/testcases/testcases_main.md"
    },
    {
      "testcase_id": "WX-YGJ-BUY-SALE-C-FN-003",
      "work_item_id": "PT083",
      "title": "确认后台未配置{特殊区}商品时，[云挂机购买页]不展示特殊区商品列表",
      "priority": "P1",
      "page_name": "云挂机购买页",
      "section_name": "特价专区",
      "module_name": "云挂机购买页",
      "feature_name": "特价专区",
      "source_path": "work_items/PT083/testcases/testcases_main.md"
    },
    {
      "testcase_id": "WX-YGJ-BUY-SALE-C-FN-004",
      "work_item_id": "PT083",
      "title": "确认最多展示4个商品",
      "priority": "P1",
      "page_name": "云挂机购买页",
      "section_name": "特价专区",